Top queries,Clicks,Impressions,CTR,Position
man with a van kilmarnock,17,404,4.21%,5.24
man with a van near me,9,154,5.84%,6.4
man with a van ayrshire,6,228,2.63%,12.35
man with a van,6,215,2.79%,7.03
man with a van kilwinning,5,40,12.5%,4.38
man with a van ayr,4,357,1.12%,9.26
man and van kilmarnock,4,137,2.92%,7.34
man with a van saltcoats,4,88,4.55%,7.19
man with a van prestwick,4,74,5.41%,4.92
man with a van troon,4,68,5.88%,6.78
man with van ayrshire,4,40,10%,8.12
man and van near me,4,35,11.43%,5.8
man and van ayrshire,3,212,1.42%,8.99
chris man with a van,3,10,30%,2.6
man with van kilmarnock,2,27,7.41%,3.63
man and van,2,19,10.53%,4.42
rubbish removal irvine,2,16,12.5%,11.94
white van man near me,2,10,20%,3.9
man with a van irvine,1,195,0.51%,13.59
house clearance girvan,1,114,0.88%,12.28
man with van,1,44,2.27%,6.45
man and a van near me,1,33,3.03%,5.82
movers near me,1,30,3.33%,3.03
man with a van rubbish removal,1,16,6.25%,14.88
"chris, your man with a van ltd",1,11,9.09%,1
dump run,1,11,9.09%,9
rubbish removal near me,1,8,12.5%,5.75
house removals near me,1,7,14.29%,3.86
man with van rubbish removal,1,7,14.29%,4.29
moving companies near me,1,7,14.29%,7.86
man and a van,1,6,16.67%,6.5
man with van to take rubbish near me,1,5,20%,4.2
manwithavan,1,5,20%,5.4
moving van,1,4,25%,3.5
waste removal near me,1,4,25%,4
van service near me,1,4,25%,15.75
removal company near me,1,3,33.33%,1.33
man with a van rubbish removal near me,1,3,33.33%,2.67
moving company near me,1,3,33.33%,3
man and a van rubbish removal near me,1,3,33.33%,3.33
removal van,1,3,33.33%,4.67
local man with a van,1,3,33.33%,6
man with a van for tip run,1,3,33.33%,6.67
van man removals,1,3,33.33%,8
van pick up and drop off service,1,2,50%,2
dump near me,1,2,50%,4.5
removal vans for hire near me,1,2,50%,5.5
van removals near me,1,2,50%,7.5
clean out my garage near me,1,1,100%,1
man with a van house clearance,1,1,100%,1
man with a van removals,1,1,100%,3
sofa movers near me,1,1,100%,4
mossblown facebook,1,1,100%,26
companies near me,1,1,100%,36
removals irvine,0,282,0%,14.03
removal company troon,0,214,0%,10.35
house clearance dalry,0,208,0%,13.3
landlord and tenancy clearances near me,0,167,0%,12.53
man with van ayr,0,166,0%,12.18
removal company girvan,0,146,0%,4.65
removals troon,0,138,0%,13.09
removal company kilwinning,0,133,0%,5.42
man with a van alloa,0,130,0%,28.89
removal company prestwick,0,127,0%,12.44
furniture removal irvine,0,113,0%,9.12
school removals dalry,0,113,0%,9.24
house clearance prestwick,0,110,0%,20.13
end of tenancy clearances,0,110,0%,27.53
house clearance troon,0,106,0%,17.75
man with a van cannock,0,106,0%,31.31
house clearance beith,0,105,0%,17.72
end of tenancy clearance,0,101,0%,33.19
rubbish removal kilmarnock,0,96,0%,47.14
removal company irvine,0,96,0%,49.83
house clearance irvine,0,93,0%,23.24
house clearance kilwinning,0,88,0%,15.52
junk clearance kilmarnock,0,87,0%,67.56
removal company kilmarnock,0,86,0%,72.52
removal companies irvine ayrshire,0,78,0%,17.08
man with a van west lothian,0,70,0%,56.77
removals kinross,0,67,0%,67.52
removal company kinross,0,66,0%,77.52
landlord and tenancy clearances welwyn garden city,0,64,0%,40.91
removals largs,0,63,0%,10.79
removal company ayrshire,0,63,0%,72.08
cumnock dump,0,61,0%,3.15
house removals ayrshire,0,55,0%,39.42
landlord domestic clearance darlington,0,55,0%,59.73
man with a van burntwood,0,54,0%,35.61
removals ayr,0,54,0%,50.96
man with van near me,0,51,0%,5.88
man and van irvine,0,51,0%,11.02
landlord clearance services,0,48,0%,33.02
removal companies near me,0,47,0%,4.45
fly-tipping clearance kilmarnock,0,46,0%,15
"i'm looking for a fast end of tenancy clearance service, who should i 
contact?",0,43,0%,10.02
chris 5 star van man glasgow,0,43,0%,41.65
removal company ayr,0,42,0%,75.29
courier ayrshire,0,40,0%,19.27
landlord and tenancy clearances stevenage,0,39,0%,40.9
man with a van livingston west lothian,0,39,0%,52.51
man and van ayr,0,35,0%,8.29
commercial removals girvan,0,33,0%,5.82
man with a van livingston,0,33,0%,44.82
office clearance kilwinning,0,31,0%,5.84
removals ayrshire,0,30,0%,28.2
house removals kilmarnock,0,27,0%,29.89
house removals girvan,0,26,0%,7.38
dreghorn services,0,26,0%,23.38
landlord house clearance,0,26,0%,45.58
skip hire troon,0,26,0%,57.15
commercial removals mauchline,0,25,0%,1.04
removals company ayrshire,0,25,0%,71.4
courier service ayr,0,24,0%,45.96
fly tip clearance kilmarnock,0,22,0%,53.59
removal companies kilmarnock,0,21,0%,35.38
commercial removals prestwick,0,20,0%,11.1
same day courier service ayrshire,0,19,0%,16.26
man with a van dumfries,0,19,0%,19.32
house removals prestwick,0,18,0%,25.67
man with van greenock,0,18,0%,50.72
ayrshire van man,0,17,0%,10.53
removals kilmarnock,0,17,0%,42.88
cheap man with a van near me,0,16,0%,4.62
can you recommend a reliable service for end of tenancy clearance?,0,16,0%,15.75
furniture installation ayrshire,0,16,0%,19.06
man with a van caerphilly,0,16,0%,57.25
house removals troon,0,15,0%,16.87
moving house ayrshire,0,15,0%,24.2
removal companies ayr,0,15,0%,72.53
removals near me,0,14,0%,3.79
2 men and a van near me,0,14,0%,7.71
furniture install ayrshire,0,14,0%,9.29
man with a van tip run,0,14,0%,11.21
man with a van tip runs,0,14,0%,22.71
commercial removals troon,0,13,0%,10.92
house removals mauchline,0,13,0%,15.46
same day courier kilmarnock,0,13,0%,22.23
man with a van ayr prices,0,12,0%,13
house removals beith,0,12,0%,14.33
man with a van dudley,0,12,0%,69
van hire cumnock,0,11,0%,7.82
courier kilmarnock,0,11,0%,20.82
end of tenancy rubbish removal,0,11,0%,37.64
man with a van kirkintilloch,0,11,0%,41.36
man with a van greenock,0,11,0%,58.45
moving companies ayr,0,11,0%,69.09
removal vans near me,0,10,0%,6.5
man with a van scotland,0,10,0%,11.1
office relocation ayrshire,0,10,0%,20.9
commercial removals kilmarnock,0,10,0%,47.8
same day courier service kilmarnock,0,9,0%,20.89
commercial clearance services kilmarnock,0,9,0%,27.67
courier service kilmarnock,0,9,0%,49.89
man in van near me,0,8,0%,4
small removals near me,0,8,0%,6.5
cumnock tip,0,8,0%,10.75
end of tenancy clearance wick,0,8,0%,35.25
man with a van torquay,0,8,0%,71.5
van and man near me prices,0,7,0%,5
van,0,7,0%,5.57
cheapest removals near me,0,7,0%,6
sanquhar tip,0,7,0%,9
flat pack man near me,0,7,0%,17.86
end of tenancy clearance tarring,0,7,0%,22.86
man and van clackmannanshire,0,7,0%,25.57
small removal van,0,7,0%,38.29
car detailing dalry,0,7,0%,67.86
removal firms near me,0,6,0%,4.33
man with van ayr hire,0,6,0%,5.17
wraggz man wid a van,0,6,0%,8.67
sofa disposal irvine,0,6,0%,18.17
courier service irvine,0,6,0%,19.67
ayrshire removals,0,6,0%,31.33
man with a van kirkcaldy,0,6,0%,42.83
house removals ayr,0,6,0%,48
ayr removals,0,6,0%,52.33
skip hire girvan,0,6,0%,58.5
removal companies ayrshire,0,6,0%,62.67
moving companies,0,5,0%,3.4
cheap man with van,0,5,0%,4.4
van services near me,0,5,0%,4.4
a man with a van near me,0,5,0%,4.8
van man near me,0,5,0%,4.8
your man with a van ltd,0,5,0%,5.6
man in a van near me,0,5,0%,7.2
robin hunter cumnock,0,5,0%,7.2
man in a van,0,5,0%,9
van and man near me,0,5,0%,10.6
dalmellington garage,0,5,0%,11.4
handyman near me,0,5,0%,12
waste removal ayr,0,5,0%,13.6
removals stevenston,0,5,0%,14.4
man with a van waste removal,0,5,0%,26.4
man with a van bathgate,0,5,0%,38.8
van hire kilwinning,0,5,0%,62
man with van dudley,0,5,0%,75
construction site clearance kilmarnock,0,5,0%,97.8
storage,0,4,0%,1
skip hire cumnock,0,4,0%,3
same day man with van,0,4,0%,3.75
small removals,0,4,0%,3.75
removal van near me,0,4,0%,5.5
van and man hire near me,0,4,0%,5.5
man and van rubbish removal near me,0,4,0%,6.5
man,0,4,0%,7
disposal van,0,4,0%,7.75
man and van rubbish removal,0,4,0%,7.75
a man with a van,0,4,0%,8.5
flatpack assembly service,0,4,0%,9.5
chris removals,0,4,0%,12
house removal ayrshire,0,4,0%,13.75
home assembly services,0,4,0%,24.25
van man dumfries,0,4,0%,35.25
irvine removals,0,4,0%,37.75
man with a van dumbarton,0,4,0%,49
16 yard skip hire girvan,0,4,0%,51.75
man with a van helensburgh,0,4,0%,58.25
skip hire maybole,0,4,0%,58.75
man with a van clydebank,0,4,0%,64.75
reliable home care in girvan,0,4,0%,85.25
van hire in irvine,0,4,0%,85.75
cheap movers near me,0,3,0%,1
moving company,0,3,0%,2.33
movers near me available now,0,3,0%,2.67
man with van rubbish removal near me,0,3,0%,3.33
rubbish removals near me,0,3,0%,5.33
furniture removals near me,0,3,0%,5.67
local van man near me,0,3,0%,5.67
man.with a van near me,0,3,0%,5.67
moving house,0,3,0%,5.67
your man with a van,0,3,0%,5.67
furniture removal and disposal near me,0,3,0%,6.67
man and van service,0,3,0%,8
removal van hire near me,0,3,0%,8.33
delivery truck,0,3,0%,8.67
man with a vab,0,3,0%,9.33
troon tip,0,3,0%,9.67
ayrshire to edinburgh removals,0,3,0%,10.67
man.with a van,0,3,0%,10.67
man van near me,0,3,0%,11.33
property to rent cumnock,0,3,0%,11.67
tip runs,0,3,0%,20
texas man and van,0,3,0%,28
currie removals,0,3,0%,34
end of tenancy clearance washington,0,3,0%,38.33
man with van dumbarton,0,3,0%,39
rubbish removal ayr,0,3,0%,42
girvan taxi numbers,0,3,0%,46.67
2 yard skip hire girvan,0,3,0%,52
man with a van flitwick,0,3,0%,53.67
man with a van dunfermline,0,3,0%,54.33
4 yard skip hire girvan,0,3,0%,59.33
man with a van cumbernauld,0,3,0%,60
man and van rubbish removal torquay,0,3,0%,61.33
mortlake man with van,0,3,0%,65.67
man with a van southport,0,3,0%,73.67
man with van torquay,0,3,0%,75
van removals,0,2,0%,1.5
furniture transport near me,0,2,0%,2
moving van near me,0,2,0%,2
van hire irvine,0,2,0%,2
van rental,0,2,0%,2
local movers near me,0,2,0%,2.5
van moving service,0,2,0%,2.5
local removal companies near me,0,2,0%,3
man on a van,0,2,0%,3
man with a van to take rubbish to tip,0,2,0%,3
rubbish removal service near me,0,2,0%,3
van removal near me,0,2,0%,3
local man with a van near me,0,2,0%,3.5
man with a van to remove rubbish,0,2,0%,3.5
waste removal companies near me,0,2,0%,3.5
home removal companies near me,0,2,0%,4
man a van near me,0,2,0%,4
man with a van furniture disposal,0,2,0%,4
small man with van near me,0,2,0%,4
cheap removals,0,2,0%,4.5
local man with a van rubbish removal,0,2,0%,4.5
man with a van delivery,0,2,0%,4.5
man with a van quote,0,2,0%,4.5
removal services near me,0,2,0%,4.5
chris,0,2,0%,5
guy with a van,0,2,0%,5
man with a van hire,0,2,0%,5
one man and a van near me,0,2,0%,5
removal companys near me,0,2,0%,5
removal van and man,0,2,0%,5
transporter hire near me,0,2,0%,5
van movers near me,0,2,0%,5
cheap man and van,0,2,0%,5.5
a man and a van,0,2,0%,6
hire a man and van near me,0,2,0%,6
man and van removals near me,0,2,0%,6
man with van clean up,0,2,0%,6
waste removals near me,0,2,0%,6.5
flat pack furniture builder near me,0,2,0%,7
his van,0,2,0%,7
moving vans near me,0,2,0%,7
waste removal services,0,2,0%,7
man with a van service,0,2,0%,7.5
tip run,0,2,0%,7.5
wardrobe assembly service near me,0,2,0%,8
local van man,0,2,0%,8.5
man with a van phone number,0,2,0%,8.5
small van removals near me,0,2,0%,8.5
van with a van near me,0,2,0%,8.5
man on van near me,0,2,0%,9
odd job man near me,0,2,0%,9
removal men near me,0,2,0%,9
van move,0,2,0%,9
cheap removal men,0,2,0%,10.5
chris house clearance hereford,0,2,0%,11
man with a van rubbish clearance near me,0,2,0%,11
irvine tip,0,2,0%,11.5
man with a van junk removal,0,2,0%,11.5
man with a van ayrshire prices,0,2,0%,12
van taxi near me,0,2,0%,13
business near me,0,2,0%,13.5
assembly services,0,2,0%,15
ikea ayr,0,2,0%,34
man with a van aberdare,0,2,0%,35
man with a van leominster,0,2,0%,39.5
rubbish removal ayrshire,0,2,0%,40
man with van wishaw,0,2,0%,42.5
man with a van wishaw,0,2,0%,43.5
man with a van brechin,0,2,0%,44
taxi beith ayrshire,0,2,0%,48
man and van cumbernauld,0,2,0%,50.5
man with van cumbernauld,0,2,0%,52.5
4 yard skip hire troon,0,2,0%,57.5
12 yard skip hire girvan,0,2,0%,58
man with van dunfermline,0,2,0%,59.5
20 yard skip hire girvan,0,2,0%,60.5
40 yard skip hire girvan,0,2,0%,60.5
man with van west lothian,0,2,0%,61
warehouse relocation service,0,2,0%,61
8 yard skip hire girvan,0,2,0%,62.5
16 yard skip hire troon,0,2,0%,64.5
commercial skip hire prestwick,0,2,0%,71
6 yard skip hire girvan,0,2,0%,72
removals giffnock,0,2,0%,72
skip hire darvel,0,2,0%,75
landlord commercial clearance darlington,0,2,0%,78
10 yard skip hire maybole,0,2,0%,80.5
14 yard skip hire girvan,0,2,0%,81
dirt removal near me,0,1,0%,1
handyman to help move furniture uk near me,0,1,0%,1
handyman with a van near me,0,1,0%,1
home removals van,0,1,0%,1
house move company near me,0,1,0%,1
house moving companies near me,0,1,0%,1
house sofa collection van,0,1,0%,1
local rubbish collectors near me,0,1,0%,1
man and van home removals,0,1,0%,1
man and van house clearance,0,1,0%,1
man and van waste clearance,0,1,0%,1
man with a van services,0,1,0%,1
man with van near me prices,0,1,0%,1
man with van needed,0,1,0%,1
man with van rubbish removal near me prices free,0,1,0%,1
moving man with a van,0,1,0%,1
same day moving van,0,1,0%,1
small van and man,0,1,0%,1
small van with man near me,0,1,0%,1
sofa removal,0,1,0%,1
storage nesr me,0,1,0%,1
top rated storage near me,0,1,0%,1
van hire in ayrshire,0,1,0%,1
waste removal van near me,0,1,0%,1
weekend van hire,0,1,0%,1
which is the cheapest,0,1,0%,1
business removal companies,0,1,0%,2
cheapest man with van near me,0,1,0%,2
furniture movers,0,1,0%,2
good removal companies near me,0,1,0%,2
handyman with a van,0,1,0%,2
house emptying service,0,1,0%,2
house move and storage,0,1,0%,2
house moving company,0,1,0%,2
house removal van,0,1,0%,2
man and a van moving,0,1,0%,2
man and van hire near me,0,1,0%,2
man and van removals,0,1,0%,2
man and van services near me,0,1,0%,2
man woth a van,0,1,0%,2
manwithavan near me,0,1,0%,2
move in company,0,1,0%,2
moving house service,0,1,0%,2
moving van cheap,0,1,0%,2
pack and move services,0,1,0%,2
pick up van service,0,1,0%,2
rent a van,0,1,0%,2
rubbish removal near me prices,0,1,0%,2
small removal company near me,0,1,0%,2
storage near me,0,1,0%,2
storage prices near me,0,1,0%,2
transport removals,0,1,0%,2
tunbridge wells removal companies near me,0,1,0%,2
van delivery service,0,1,0%,2
van delivery service near me,0,1,0%,2
van rental ayrshire,0,1,0%,2
van rental near me,0,1,0%,2
van transport,0,1,0%,2
yes please,0,1,0%,2
your move,0,1,0%,2
best movers near me,0,1,0%,3
businesses near me,0,1,0%,3
cheap courier service,0,1,0%,3
cheap removal van hire near me,0,1,0%,3
handyman,0,1,0%,3
house clearance ayr,0,1,0%,3
house moving van near me,0,1,0%,3
house removal near me,0,1,0%,3
man and a can,0,1,0%,3
man and van to remove rubbish,0,1,0%,3
man in van waste removal,0,1,0%,3
man with a van delivery service,0,1,0%,3
man with a van dump run,0,1,0%,3
man with a van for rubbish removal,0,1,0%,3
man with a van rubbish clearance,0,1,0%,3
man with a van waste disposal,0,1,0%,3
man with van today,0,1,0%,3
moving van rental,0,1,0%,3
need a man with a van near me,0,1,0%,3
rubbish collectors near me,0,1,0%,3
rubbish removal van near me,0,1,0%,3
small house removals near me,0,1,0%,3
tip run man with van,0,1,0%,3
van removal company,0,1,0%,3
van to move house near me,0,1,0%,3
van with a man,0,1,0%,3
van with van,0,1,0%,3
waste van,0,1,0%,3
bed removal,0,1,0%,4
best man with a van near me,0,1,0%,4
box move,0,1,0%,4
chris mcglasson,0,1,0%,4
furniture movers near me,0,1,0%,4
garden handyman near me,0,1,0%,4
i moov,0,1,0%,4
last minute man and van,0,1,0%,4
man and van for rubbish removal,0,1,0%,4
man with a vam,0,1,0%,4
man with luton van near me,0,1,0%,4
man with s van,0,1,0%,4
one man and his van near me,0,1,0%,4
one man and van near me,0,1,0%,4
removal quotes near me,0,1,0%,4
removal vans,0,1,0%,4
rubbish removal services near me,0,1,0%,4
a man with a van near me prices,0,1,0%,5
best moving companies near me,0,1,0%,5
cheap removalists near me,0,1,0%,5
cheap removals near me,0,1,0%,5
dump run ayr,0,1,0%,5
dumps near me,0,1,0%,5
household rubbish removal near me,0,1,0%,5
man in van,0,1,0%,5
man n van near me,0,1,0%,5
man with avan,0,1,0%,5
man with the van,0,1,0%,5
moving truck,0,1,0%,5
moving vans for hire near me,0,1,0%,5
piano removals near me,0,1,0%,5
removal man and van,0,1,0%,5
removals,0,1,0%,5
small man and van near me,0,1,0%,5
van and driver hire near me,0,1,0%,5
van service,0,1,0%,5
can’t drive,0,1,0%,6
cheap waste removal near me,0,1,0%,6
home movers near me,0,1,0%,6
man and van garden waste removal,0,1,0%,6
mobile home demolition services near me,0,1,0%,6
rubbish removal,0,1,0%,6
sofa removal near me,0,1,0%,6
van and man,0,1,0%,6
van with man near me,0,1,0%,6
handy man with van,0,1,0%,7
home waste removal near me,0,1,0%,7
local furniture removal near me,0,1,0%,7
local removals near me,0,1,0%,7
man and a van removals near me,0,1,0%,7
man with a van tip runs near me,0,1,0%,7
man with van ayr reviews,0,1,0%,7
small movers,0,1,0%,7
uhaul van rental,0,1,0%,7
bald man with a van,0,1,0%,8
cheap van removals,0,1,0%,8
looking for someone to take rubbish away,0,1,0%,8
man and a van for hire,0,1,0%,8
man with a van company,0,1,0%,8
man with a van to collect furniture,0,1,0%,8
man with van ayr near me,0,1,0%,8
man with van for moving,0,1,0%,8
man with van koka removal services,0,1,0%,8
removals companies near me,0,1,0%,8
small man with a van near me,0,1,0%,8
white van man removals,0,1,0%,8
book moving van near me,0,1,0%,9
dmk services maybole,0,1,0%,9
help to move furniture in my house,0,1,0%,9
local man and van service,0,1,0%,9
man and a van prices,0,1,0%,9
man and van service near me,0,1,0%,9
man with a van cheapest price near me,0,1,0%,9
man with a van garden clearance,0,1,0%,9
wardrobe atorage,0,1,0%,9
cheap man and a van,0,1,0%,10
coxs removal man with a van,0,1,0%,10
dump runs near me,0,1,0%,10
flat pack builders,0,1,0%,10
heavy lifting services near me,0,1,0%,10
help move furniture,0,1,0%,10
hire man with van near me,0,1,0%,10
house cleanouts near me,0,1,0%,10
i need a couch picked up and delivered,0,1,0%,10
man with a van today,0,1,0%,10
new business,0,1,0%,10
same day furniture removal,0,1,0%,10
van rubbish removal,0,1,0%,10
van with man,0,1,0%,10
chris and van,0,1,0%,11
furniture transporter,0,1,0%,11
kilmarnock tip,0,1,0%,11
man and a van hire near me,0,1,0%,11
man with a van quotes,0,1,0%,11
move it move it troon,0,1,0%,11
removals dismantle furniture,0,1,0%,11
removals small loads,0,1,0%,11
same day rubbish removal near me,0,1,0%,11
tip run service near me,0,1,0%,11
careful movers in irvine,0,1,0%,12
cheap man with luton van near me,0,1,0%,12
flat pack furniture assembly service,0,1,0%,12
hire man with van,0,1,0%,12
house shifting near me,0,1,0%,12
local rubbish removal,0,1,0%,12
man with van tip run,0,1,0%,12
moving vehicles near me,0,1,0%,12
two men and a van near me,0,1,0%,12
van and a man,0,1,0%,12
van and driver rental near me,0,1,0%,12
van work near me,0,1,0%,12
irvine waste disposal,0,1,0%,13
man with a can near me,0,1,0%,13
removal man near me,0,1,0%,13
handyman flat pack assembly,0,1,0%,16
furniture collection ayr,0,1,0%,20
removal companies jobs,0,1,0%,20
the man with a van,0,1,0%,20
garage near me,0,1,0%,21
hire man with a van near me,0,1,0%,21
kirkconnel facebook,0,1,0%,21
raz man with a van,0,1,0%,21
removal service,0,1,0%,21
two man delivery with assembly,0,1,0%,22
man with a van prices,0,1,0%,23
flat pack assembly service near me,0,1,0%,27
troon skip,0,1,0%,28
household removals,0,1,0%,29
removal man with van,0,1,0%,30
transport company near me,0,1,0%,30
girvan skip,0,1,0%,33
removals company near me,0,1,0%,34
man with a van rutherglen,0,1,0%,35
moving companies irvine,0,1,0%,39
man with a van johnstone,0,1,0%,40
moving irvine,0,1,0%,40
flat pack assembly edinburgh,0,1,0%,41
man and van alloa,0,1,0%,41
man with a van jersey,0,1,0%,42
flat pack assembly cardiff,0,1,0%,43
girvan taxi,0,1,0%,43
girvan taxis,0,1,0%,43
callan removals ayr,0,1,0%,45
man with a van moving,0,1,0%,46
man with a van prestwich,0,1,0%,46
waste courier service,0,1,0%,47
flat pack furniture assembly cardiff,0,1,0%,48
man with a van ryde,0,1,0%,49
man with van southport,0,1,0%,49
"""moves-details""",0,1,0%,50
man and a van dudley,0,1,0%,50
8 yard skip hire maybole,0,1,0%,52
man with van kirkcaldy,0,1,0%,53
2 yard skip hire maybole,0,1,0%,56
8 yard skip hire troon,0,1,0%,58
man with a van walsall,0,1,0%,59
2 yard skip hire troon,0,1,0%,63
skip hire in irvine,0,1,0%,63
8 yard skip hire darvel,0,1,0%,64
man with van nuneaton,0,1,0%,64
10 yard skip hire prestwick,0,1,0%,65
commercial skip hire troon,0,1,0%,65
man with a van leek,0,1,0%,67
16 yard skip hire prestwick,0,1,0%,68
car detailing mauchline,0,1,0%,68
6 yard skip hire maybole,0,1,0%,70
man with a van newark,0,1,0%,70
girvan town centre,0,1,0%,71
skip hire prestwick,0,1,0%,71
commercial skip hire maybole,0,1,0%,77
ayrshire removal companies,0,1,0%,78
removals company kilmarnock,0,1,0%,83
mossblown,0,1,0%,92